chapter,shlok,text,list_metaphors,count_metaphors,refined,verb_refined,count_met_ref,count_verb_ref
18,54,"  One with Brahman and at peace with himself, he grieves not, nor desires;  holding all beings alike, he achieves supreme devotion to Me.   ","['with', 'at peace with', 'holding', 'devo', 'to']",5,"['at peace with', 'holding', 'devo']",['holding'],3,1
18,55,"  By devotion, he realizes in truth how great I am, who I am; and having  known Me in reality he enters into Me.   ","['in', 'great', 'in', 'enter', 'into']",5,"['great', 'enter']",[],2,0
18,56,"  Even whilst always performing actions, he who makes Me his refuge wins,  by My grace, the eternal and imperishable haven.   ","['makes', 'refuge win', 'haven']",3,"['makes', 'refuge win', 'haven']",['makes'],3,1
18,57,"  Casting, with your mind, all actions on Me, make Me your goal, and resorting  to the yoga of even-mindedness fix your thought ever on Me.   ","['Cast', 'with', 'on', 'make', 'goal', 'to', 'fix', 'on']",8,"['Cast', 'make', 'goal', 'fix']",['make'],4,1
18,58,"  Fixing his your thought on Me, you shall surmount all obstacles by My  grace; but if possessed by the sense of ‘I' you listen not, you shall perish.   ","['Fix', 'on', 'mount', 'obstacles', 'possess']",5,"['Fix', 'mount', 'obstacles', 'possess']",[],4,0
18,59,"  If obsessed by the sense of ‘I', you thinks, ‘I will not fight', vain is your  obsession; (thy) nature will compel you.   ","['sense', 'compel']",2,"['sense', 'compel']",[],2,0
18,60,"  What you will not do, O Arjuna, because of your delusion, you shall do,  even against your will, bound as you are by the duty to which you are born.   ","['against', 'bound', 'to']",3,['bound'],[],1,0
18,61,"  God, O Arjuna, dwells in the heart of every being and by His delusive  mystery whirls them all, (as though) set on a machine.   ","['dwell', 'in', 'heart', 'whirls', 'set on']",5,"['dwell', 'heart', 'whirls', 'set on']",['set on'],4,1
18,62,"  In Him alone seek your refuge with all your heart, O Arjuna. By His grace  shall you win to the eternal haven of supreme peace.   ","['In', 'seek', 'refuge with', 'win to', 'haven']",5,"['seek', 'refuge with', 'win to', 'haven']",[],4,0
18,63,"  Thus have I expounded to you the most mysterious of all knowledge;  ponder over it fully, then act as you will.   ","['expounded to', 'over']",2,['expounded to'],['expounded to'],1,1
18,64,"  Hear again My supreme word, the most mysterious of all; dearly beloved  you are of Me, hence I desire to declare your welfare.   ",[],0,[],[],0,0
18,65,"  On Me fix your mind, to Me bring your devotion, to Me offer your sacrifice, to  Me make your obeisance; to Me indeed shall you come—solemn is My promise  to you, you are dear to Me.    ","['On', 'fix', 'to', 'bring', 'to', 'sacrifice', 'to', 'make', 'to', 'to', 'to']",11,"['fix', 'bring', 'sacrifice', 'make']",['make'],4,1
18,66,  Abandon all duties and come to Me the only refuge. I will release you from  all sins; grieve not!   ,"['on', 'refuge', 'release', 'from']",4,"['refuge', 'release']",[],2,0
18,67,"  Utter this never to him who knows no austerity, has no devotion, nor any  desire to listen, nor yet to him who scoffs at Me.   ","['this', 'to', 'has', 'to', 'at']",5,['has'],['has'],1,1
18,68,"  He who will propound this supreme mystery to My devotees, shall, by that  act of highest devotion to Me, surely come to Me.   ","['this', 'to', 'that', 'highest', 'to', 'come to']",6,"['highest', 'come to']",[],2,0
18,69,  Nor among men is there any who renders dearer service to Me than he; nor  shall there be on earth any more beloved by Me than he.   ,"['among', 'render', 'service to']",3,"['render', 'service to']",[],2,0
18,70,"  And the man of faith who, scorning not, will but listen to it,—even he shall  be released and will go to the happy worlds of men of virtuous deeds.   ","['to', 'happy world']",2,['happy world'],[],1,0
18,71,"  Have you heard this, O Arjuna, with a concentrated mind? Has your delusion,  born of ignorance, been destroyed, O Arjuna?  Arjuna Said:   ","['this', 'with', 'concentrat', 'born', 'destroy']",5,"['concentrat', 'born', 'destroy']",[],3,0
18,72,"  Thanks to Your grace, O Krishna, my delusion is destroyed, my  understanding has returned. I stand secure, my doubts all dispelled; I will do  your bidding.  Sanjaya Said:   ","['to', 'destroy', 'returned', 'stand']",4,"['destroy', 'returned', 'stand']",['returned'],3,1
18,73,  Thus did I hear this marvellous and thrilling discourse between Krishna  and the great-souled Arjuna.   ,"['this', 'between', 'great', 'sou']",4,"['great', 'sou']",[],2,0
18,74,"  It was by Vyasa's favor that I listened to this supreme and mysterious Yoga  as expounded by the lips of the Master of Yoga, Krishna Himself.   ","['to this', 'myste', 'expounded']",3,"['to this', 'myste', 'expounded']",['expounded'],3,1
18,75,"  O King, as often as I recall that marvellous and purifying discourse between  Krishna and Arjuna, I am filled with recurring rapture.   ","['recall that', 'purifying', 'between', 'filled with', 'rapture']",5,"['recall that', 'purifying', 'filled with', 'rapture']","['purifying', 'filled with']",4,2
18,76,"  And as often as I recall that marvellous form of Krishna, my wonder knows no  bounds and I rejoice again and again.   ","['recall that', 'form', 'knows', 'bounds']",4,"['recall that', 'form', 'knows', 'bounds']",[],4,0
18,77,"  Wheresoever Krishna, the Master of Yoga, is, and wheresoever is Arjuna the  Bowman, there rest assured are Fortune, Victory, Prosperity, and Eternal Right.",[],0,[],[],0,0
16,1,"  Fearlessness, purity of heart, steadfastness in jnana and yoga—knowledge  and action, beneficence, self-restraint, sacrifice, spiritual study, austerity, and  uprightness;   ",['in'],1,[],[],0,0
16,2,"  Non-violence, truth, slowness to wrath, the spirit of dedication, serenity,  aversion to slander, tenderness to all that lives, freedom from greed, gentleness,  modesty, freedom from levity;   ","['slow', 'to', 'spirit', 'version to', 'to', 'freedom from', 'freedom from']",7,"['slow', 'spirit', 'version to', 'freedom from', 'freedom from']",['slow'],5,1
16,3,"  Spiritedness, forgiveness, fortitude, purity, freedom from ill-will and  arrogance—these are to be found in one born with the divine heritage, O  Arjuna.   ","['freedom from', 'these', 'found in', 'with']",4,"['freedom from', 'found in']",['found in'],2,1
16,4,"  Pretentiousness, arrogance, self-conceit, wrath, coarseness, ignorance—these  are to be found in one born with the devilish heritage.   ","['coarse', 'these', 'found in', 'with']",4,"['coarse', 'found in']",['found in'],2,1
16,5,"  The divine heritage makes for Freedom, the devilish for bondage. Grieve not,  O Arjuna; you are born with a divine heritage.   ","['makes', 'with']",2,['makes'],['makes'],1,1
16,6,"  There are two orders of created beings in this world—the divine and the  devilish; the divine order has been described in detail, hear from Me now of the  devilish, O Arjuna.   ","['orders', 'this', 'order', 'in', 'from']",5,"['orders', 'order']",[],2,0
16,7,"  Men of the devil do not know what they may do and what they may not do;  neither is there any purity, nor right conduct, nor truth to be found in them.   ",['found in'],1,['found in'],['found in'],1,1
16,8,"  ‘Without truth, without basis, without God is the universe,' they say; ‘born of  the union of the sexes, prompted by nothing but lust.'   ","['Without', 'without', 'without', 'union', 'prompt']",5,"['union', 'prompt']",[],2,0
16,9,"  Holding this view, these depraved souls, of feeble understanding and of  fierce deeds, come forth as enemies of the world to destroy it.     ","['Holding this view', 'these', 'feeble', 'fierce', 'come for', 'enemies', 'destroy']",7,"['Holding this view', 'feeble', 'fierce', 'come for', 'enemies', 'destroy']",['Holding this view'],6,1
16,10,"  Given to insatiable lust, possessed by pretentiousness, arrogance and  conceit, they seize wicked purposes in their delusion, and go about pledged to  uncleaned deeds.   ","['to', 'possess', 'seize wicked', 'in', 'about pledged to uncleaned']",5,"['possess', 'seize wicked', 'about pledged to uncleaned']","['seize wicked', 'about pledged to uncleaned', 'about pledged to uncleaned']",3,3
16,11,"  Given to boundless cares that end only with their death, making indulgence  or lust their sole goal, convinced that that is all;   ","['to', 'bound', 'with', 'making', 'goal', 'that']",6,"['bound', 'making', 'goal']",['making'],3,1
16,12,"  Caught in a myriad snares of hope, slaves to lust and wrath, they speak  unlawfully to amass wealth for the satisfaction of their appetites.   ","['Caught in', 'snar', 'mas']",3,"['Caught in', 'snar', 'mas']",[],3,0
16,13,  ‘This have I gained today; this aspiration shall I now attain; this wealth is  mine; this likewise shall be mine hereafter;   ,"['This', 'this', 'attain', 'this', 'this']",5,['attain'],[],1,0
16,14,"  ‘This enemy I have already slain, others also I shall slay; lord of all am I;  enjoyment is mine, perfection is mine, strength is mine, happiness is mine;   ",['This'],1,[],[],0,0
16,15,"  ‘Wealthy am I, and high-born. What other is like unto me? I shall perform a  sacrifice! I shall give alms! I shall be merry!' Thus think they, by ignorance  deluded;   ","['high', 'unto', 'sacrifice']",3,"['high', 'unto', 'sacrifice']",[],3,0
16,16,"  And tossed about by diverse fancies, caught in the net of delusion, stuck  deep in the indulgence of appetites, into foul hell they fall.   ","['tossed about', 'caught in', 'net', 'stuck deep in', 'into foul hell', 'fall']",6,"['tossed about', 'caught in', 'net', 'stuck deep in', 'into foul hell', 'fall']",['tossed about'],6,1
16,17,"  Wise in their own conceit, stubborn, full of the intoxication of pelf and pride,  they offer nominal sacrifices for show, contrary to the rule.   ","['in', 'conceit', 'full', 'toxication', 'sacrifice', 'rule']",6,"['conceit', 'full', 'toxication', 'sacrifice', 'rule']",[],5,0
16,18,"  Given to pride, force, arrogance, lust and wrath they are deriders indeed,  scorning Me in their own and other' bodies.   ","['in', 'bo']",2,['bo'],[],1,0
16,19,"  These cruel scorners, lowest of mankind and vile, I hurl down again and  again, into devilish wombs.   ","['These', 'ners', 'lowest', 'lish womb']",4,"['ners', 'lowest', 'lish womb']",[],3,0
16,20,"  Doomed to devilish wombs, these deluded ones, far from ever coming to  Me, sink lower and lower in birth after birth.   ","['Doom', 'to', 'these', 'far from', 'sink', 'in', 'after']",7,"['Doom', 'far from', 'sink']",[],3,0
16,21,"  Three-fold is the gate of hell, leading man to perdition—Lust, Wrath, and  Greed; these three, therefore, should be shunned.   ","['gate', 'leading', 'to', 'these']",4,"['gate', 'leading']",['leading'],2,1
16,22,"  The man who escapes these three gates of Darkness, O Arjuna, works out  his welfare and from there reaches the highest state.   ","['these', 'gates', 'reach', 'highest']",4,"['gates', 'reach', 'highest']",[],3,0
16,23,"  He who forsakes the rule of shastra and does but the bidding of his selfish  desires, gains neither perfection, nor happiness, nor the highest state.  Shastra does not mean the rites and formulae laid down in the so-called  dharmashastra, but the path of self-restraint laid down by the seers and the  saints.    ","['forsak', 'rule', 'ish', 'gain', 'highest', 'formula', 'laid down in', 'path', 'laid down']",9,"['forsak', 'rule', 'ish', 'gain', 'highest', 'formula', 'laid down in', 'path', 'laid down']","['laid down in', 'laid down']",9,2
16,24,  Therefore let shastra be your authority for determining what ought to be  done and what ought not to be done; ascertain you the rule of the shastra and  do your task here (accordingly).,"['rule', 'here']",2,"['rule', 'here']",[],2,0
8,1,"  What is that Brahman? What is Adhyatma? What Karma, O Krishna?  What is called Adhibhuta? And what Adhidaiva?   ",['that'],1,[],[],0,0
8,2,  And who here in this body is Adhiyajna and how? And how at the time of  death are You to be known by the self-controlled?  The Lord Said:   ,['at'],1,[],[],0,0
8,3,"  The Supreme, the Imperishable is Brahman; its manifestation is Adhyatma;  the creative process whereby all beings are created is called Karma.   ",[],0,[],[],0,0
8,4,"  Adhibhuta is My perishable form; Adhidaivata is the individual self in that  form; and O best among the embodied, Adhiyajna am I in this body, purified by  sacrifice.   ","['per', 'form', 'in that form', 'in this', 'purified']",5,"['form', 'in that form', 'in this', 'purified']",['purified'],4,1
8,5,"  And he who, at the last hour remembering Me only, departs leaving the  body, enters into Me; of that there is no doubt.   ",['at'],1,[],[],0,0
8,6,"  Or whatever form a man continually contemplates, that same he remembers  in the hour of death, and to that very form he goes, O Arjuna.   ","['form', 'contempla', 'that', 'in', 'to that', 'form', 'goes']",7,"['form', 'contempla', 'to that', 'form', 'goes']",['goes'],5,1
8,7,  Therefore at all times remember Me and fight on; your mind and reason thus  on Me fixed you shall surely come to Me.   ,"['at', 'fight on', 'on', 'fixed', 'to']",5,"['fight on', 'fixed']",['fixed'],2,1
8,8,"  With thought steadied by constant practice, and wandering nowhere, he who  meditates on the Supreme Celestial Being, O Arjuna, goes to Him.   ","['With', 'steadied', 'on', 'Supreme']",4,"['steadied', 'Supreme']",['steadied'],2,1
8,9,"  Whoso, at the time of death, with unwavering mind, with devotion, and  fixing the breath rightly between the brows by the power of yoga, meditates on  the Sage, the Ancient, the Ruler, subtler than the subtlest, the Supporter of all,  the Inconceivable, glorious as the sun beyond the darkness,—he goes to that  Supreme Celestial Being.   ","['at', 'with unwavering', 'with', 'fix', 'power', 'on', 'sun beyond', 'goes to that Supreme', 'ing']",9,"['with unwavering', 'fix', 'power', 'sun beyond', 'goes to that Supreme', 'ing']","['goes to that Supreme', 'ing']",6,2
8,10,"  Whoso, at the time of death, with unwavering mind, with devotion, and  fixing the breath rightly between the brows by the power of yoga, meditates on  the Sage, the Ancient, the Ruler, subtler than the subtlest, the Supporter of all,  the Inconceivable, glorious as the sun beyond the darkness,—he goes to that  Supreme Celestial Being.  ","['at', 'with unwavering', 'with', 'fix', 'power', 'on', 'sun beyond', 'goes to that Supreme', 'ing']",9,"['with unwavering', 'fix', 'power', 'sun beyond', 'goes to that Supreme', 'ing']","['goes to that Supreme', 'ing']",6,2
8,11,"  That which the knowers of the Vedas call the Imperishable (or that word  which the knowers of the Vedas repeat), wherein the ascetics freed from  passion enter and desiring which they practice brahmacharya, that Goal (or  Word) I will declare to you in brief.   ","['That', 'that', 'in', 'freed from', 'that', 'to']",6,['freed from'],[],1,0
8,12,"  Closing all the gates, locking up the mind in the hridaya, fixing his breath  within the head, carried in yogic meditation;   ","['lock', 'up', 'fix', 'carried in']",4,"['lock', 'up', 'fix', 'carried in']",['carried in'],4,1
8,13,"  Whoso departs leaving the body uttering AUM—Brahman in one  syllable—repeatedly thinking on Me, he reaches the highest state.   ","['uttering', 'in', 'on', 'reach', 'highest state']",5,"['uttering', 'reach', 'highest state']",['uttering'],3,1
8,14,"  That yogi easily wins to Me, O Arjuna, who, ever attached to Me, constantly  remembers Me with undivided mind.   ","['That', 'win', 'to', 'attached to', 'with']",5,"['win', 'attached to']",['attached to'],2,1
8,15,"  Great souls, having come to Me, reach the highest perfection; they come not  again to birth, unlasting and (withal) an abode of misery.   ","['Great', 'reach', 'highest', 'come', 'to', 'withal', 'abode']",7,"['Great', 'reach', 'highest', 'come', 'withal', 'abode']",['come'],6,1
8,16,"  From the world of Brahma down, all the worlds are subject to return, O  Arjuna; but on coming to Me there is no rebirth.   ","['From', 'world', 'down', 'subject', 'return', 'on']",6,"['world', 'down', 'subject', 'return']",[],4,0
8,17,"  Those men indeed know what is Day and what is Night, who know that  Brahma's day lasts a thousand yugas and that his night too is a thousand yugas  long.    ",['Those'],1,[],[],0,0
8,18,"  At the coming of Day all the manifest spring forth from the Unmanifest, and  at the coming of Night they are dissolved into that same Unmanifest.   ","['At', 'coming', 'spring forth from', 'at', 'coming', 'into that']",6,"['coming', 'spring forth from', 'coming', 'into that']","['coming', 'coming']",4,2
8,19,"  This same multitude of creatures come to birth, O Arjuna, again and again;  they are dissolved at the coming of Night, whether they will or not; and at the  break of Day they are re-born.   ","['This', 'come to', 'at', 'coming', 'at', 'break']",6,"['come to', 'coming', 'break']",['coming'],3,1
8,20,"  But higher than the Unmanifest is another Unmanifest Being, everlasting,  which perishes not when all creatures perish.   ",['higher than'],1,['higher than'],[],1,0
8,21,"  This Unmanifest, named the Imperishable, is declared to be the highest goal.  For those who reach it there is no return. That is my highest abode.   ","['This', 'declare', 'highest goal', 'reach it', 'return', 'That', 'highest abode']",7,"['declare', 'highest goal', 'reach it', 'return', 'highest abode']",[],5,0
8,22,"  This Supreme Being, O Arjuna, may be won by undivided devotion; in It all  beings dwell, by It all is pervaded.   ","['This Supreme', 'won', 'in', 'dwell', 'pervad']",5,"['This Supreme', 'won', 'dwell', 'pervad']",[],4,0
8,23,"  Now I will tell you, Arjuna, the conditions which determine the  exemption from return, as also the return, of yogins after they pass away hence.   ",['from'],1,[],[],0,0
8,24,"  Fire, Light, Day, the Bright Fortnight, the six months of the Northern  Solstice—through these departing men knowing Brahman go to Brahman.   ","['Bright', 'through these']",2,"['Bright', 'through these']",[],2,0
8,25,"  Smoke, Night, the Dark Fortnight, the six months of the Southern  Solstice—There through the yogin attains to the lunar light and from there returns.    ",[],0,[],[],0,0
8,26,"  These two paths—bright and dark—are deemed to be the eternal paths of  the world; by the one a man goes to return not, by the other he returns again.   ","['These', 'bright', 'em', 'by', 'by']",5,"['bright', 'em']",[],2,0
8,27,"  The Yogin knowing these two paths falls not into delusion, O Arjuna;  therefore, at all times, O Arjuna, remain steadfast in yoga.   ","['these', 'paths falls', 'into', 'at', 'in']",5,['paths falls'],[],1,0
8,28,"  Whatever fruit of good deeds is laid down as accruing from (a study of) the  Vedas, from sacrifices, austerities, and acts of charity—all that the yogin  transcends, on knowing this, and reaches the Supreme and Primal Abode.","['fruit', 'laid down', 'from', 'from', 'transcend', 'on', 'this', 'reach', 'Abode']",9,"['fruit', 'laid down', 'transcend', 'reach', 'Abode']",['laid down'],5,1
15,1,"  With the root above and branches below, the ashvattha tree, they say, is  impossible; it has Vedic hymns for its leaves; he who knows it knows the Vedas.   ","['With', 'has']",2,['has'],['has'],1,1
15,2,"  Above all and below its branches spread, blossoming because of the gunas,  having for their shoots the sense-objects; deep down in the world of men are  ramified its roots, in the shape of the consequences of action.   ","['having', 'sense', 'objects', 'deep down in', 'roots', 'in']",6,"['having', 'sense', 'objects', 'deep down in', 'roots']",['having'],5,1
15,3,"  Its form as such is not here perceived, neither is its end, nor beginning, nor  basis. Let man first hew down this deep-rooted Ashvattha with the sure  weapon of detachment;   ","['form', 'here percei', 'end', 'hew down this deep', 'root', 'sure weapon', 'detachment']",7,"['form', 'here percei', 'end', 'hew down this deep', 'root', 'sure weapon', 'detachment']",[],7,0
15,4,  Let him pray to win to that haven from which there is no return and seek to  find refuge in the primal Being from whom has emanated this ancient world of  action.   ,"['that', 'seek', 'find refuge in', 'from', 'emanated this', 'cient world']",6,"['seek', 'find refuge in', 'emanated this', 'cient world']","['find refuge in', 'emanated this']",4,2
15,5,"  To that imperishable haven those enlightened souls go—who are without  pride and delusion, who have triumphed over the taints of attachment, who are  ever in tune with the Supreme, whose passions have died, who are exempt  from the pairs of opposites, such as pleasure and pain.   ","['To that', 'those', 'go', 'without', 'over', 'taints', 'attachment', 'with', 'exempt from', 'pair', 'opposites']",11,"['To that', 'go', 'taints', 'attachment', 'exempt from', 'pair', 'opposites']",['go'],7,1
15,6,"  Neither the sun, nor the moon, nor fire illumine it; men who arrive there  return not—that is My supreme abode.   ",['that'],1,[],[],0,0
15,7,"  As part indeed of Myself which has been the eternal Jiva(the Vital Essence) in this world of life,  attracts the mind and the five senses from their place in prakriti.   ","['part', 'Vital Essence', 'in this world', 'attract', 'from', 'place in']",6,"['part', 'Vital Essence', 'in this world', 'attract', 'place in']",[],5,0
15,8,"  When the master (of the body) acquires a body and discards it he carries  these with him wherever he goes, even as the wind carries scents from flower  beds.   ",['carries'],1,['carries'],['carries'],1,1
15,9,"  Having settled himself in the senses—ear, eye, touch, taste, and smell—as  well as the mind, through them he frequents their objects.   ","['settled', 'through', 'frequent']",3,"['settled', 'frequent']",['settled'],2,1
15,10,  The deluded perceive Him not as He leaves or settles in (a body) or enjoys  (sense objects) in association with the gunas; it is those endowed with the eye of  knowledge who alone see Him.   ,"['in', 'those']",2,[],[],0,0
15,11,"  Yogins who strive see Him seated in themselves; the witless ones who have  not cleansed themselves to see Him not, even though they strive.   ",[],0,[],[],0,0
15,12,"  The light in the sun which illumines the whole universe and which is in the  moon and in fire—that light, know you, is Mine;   ","['in', 'that']",2,[],[],0,0
15,13,"  It is I, who penetrating the earth uphold all beings with My strength, and  becoming the moon—the essence of all sap—nourish all the herbs;   ","['hold', 'with', 'nce', 'nourish']",4,"['hold', 'nce', 'nourish']",[],3,0
15,14,"  It is I who becoming the Vaishvanara Fire and entering the bodies of all that  breathe, assimilate the four kinds of food with the help of the outward and the  inward breaths.   ","['Fire', 'with', 'help']",3,"['Fire', 'help']",[],2,0
15,15,"  And I am seated in the hearts of all, from Me proceed memory, knowledge  and the dispelling of doubts; it is I who am to be known in all the Vedas, I, the  author of Vedanta and the knower of the Vedas.   ","['seated in', 'heart', 'from', 'proceed', 'in']",5,"['seated in', 'heart', 'proceed']",['seated in'],3,1
15,16,  There are two Beings in the world: perishable (perishable) and imperishable  (imperishable). Perishable embraces all creatures and their permanent basis is  imperishable.   ,['embraces'],1,['embraces'],[],1,0
15,17,  The Supreme Being is surely another—called eternal Soul who is the  Imperishable Supreme Being pervades and supports the three worlds.   ,"['Supreme', 'pervad', 'support']",3,"['Supreme', 'pervad', 'support']",[],3,0
15,18,"  Because I transcend the perishable and am also higher than the imperishable, I am  known in the world and in the Vedas as Krishna (the Highest Being).   ","['higher', 'in', 'in', 'High']",4,"['higher', 'High']",[],2,0
15,19,"  He who, undeluded, knows Me as Krishna, knows all, he worships  Me with all his heart, O Arjuna.    ","['with', 'heart']",2,['heart'],[],1,0
15,20,"  Thus I have revealed to you, sinless one, this most mysterious shastra; he  who understands this, O Arjuna, is a man of understanding, he has fulfilled his  life's mission.","['to', 'this', 'this', 'mission']",4,['mission'],[],1,0
4,1,"  I expounded this imperishable yoga to Vivasvat; Vivasvat communicated it to  Manu, and Manu to Ikshvaku.   ","['exp', 'this', 'to', 'communica', 'to', 'to']",6,"['exp', 'communica']",[],2,0
4,2,"  Thus handed down in succession, the royal sages learnt it; with long lapse of  time it dwindled away in this world, O Arjuna.   ","['in', 'with long lapse', 'd', 'away in this']",4,"['with long lapse', 'd', 'away in this']",[],3,0
4,3,"  The same ancient yoga have I expounded to you today; for you are My  devotee and My friend, and this is the supreme mystery.  Arjuna Said:   ","['expounded to', 'this']",2,['expounded to'],['expounded to'],1,1
4,4,"  Later was Your birth, my Lord, earlier that of Vivasvat. How then am I to  understand that You didst expound it in the beginning?  The Lord Said:   ","['Lord', 'that', 'in']",3,['Lord'],[],1,0
4,5,"  Many births have we passed through, O Arjuna, both you and I; I know  them all, you know them not, O Arjuna.  Though unborn and inexhaustible in My essence, though Lord of all beings, yet  assuming control over My Nature, I come into being by My mysterious power.   ","['s', 'through', 'un', 'haus', 'in', 'nce', 'Lord', 'ssum', 'over', 'come into', 'power']",11,"['s', 'un', 'haus', 'nce', 'Lord', 'ssum', 'come into', 'power']",['come into'],8,1
4,6,"  For whenever Right declines and Wrong prevails, then O Arjuna, I come to  birth.     ","['decline', 'come to']",2,"['decline', 'come to']",[],2,0
4,7,"  To save the righteous, to destroy the wicked, and to re-establish Right I am  born from age to age.    ","['from', 'to']",2,[],[],0,0
