chapter,shlok,text,list_metaphors,count_metaphors,refined,verb_refined,count_met_ref,count_verb_ref
4,8,"  He who knows the secret of this My divine birth and action is not born again,  after leaving the body; he comes to Me, O Arjuna.    ","['this', 'after']",2,[],[],0,0
4,9,"  Freed from passion, fear and wrath, filled full with Me, relying on Me, and  refined by the fiery ordeal of knowledge, many have become one with Me.   ","['Freed from', 'filled full', 'on', 'refin', 'fiery']",5,"['Freed from', 'filled full', 'refin', 'fiery']",['filled full'],4,1
4,10,"  In whatever way men resort to Me, even so do I render to them. In every  way, O Arjuna, the path men follow is Mine.    ","['In', 'way', 'resort to', 'render to', 'In', 'way', 'path', 'follow']",8,"['way', 'resort to', 'render to', 'way', 'path', 'follow']",['follow'],6,1
4,11,  Those who desire their actions to bear fruit worship the gods here; for in this  world of men the fruit of action is quickly obtainable.    ,"['bear fruit worship', 'in this world', 'fruit', 'quickly']",4,"['bear fruit worship', 'in this world', 'fruit', 'quickly']",[],4,0
4,12,"  The order of the four varnas was created by Me according to the different  gunas and karma of each; yet know that though, therefore, author thereof,  being changeless I am not the author.   ","['s', 'there']",2,"['s', 'there']",[],2,0
4,13,"  Actions do not affect Me, nor am I concerned with the fruits thereof. He who  recognizes Me as such is not bound by actions.    ","['with', 'fruits', 'bound']",3,"['fruits', 'bound']",[],2,0
4,14,"  Knowing this did men of old, desirous of freedom, perform action; do you,  then, just as they did—the men of old in days gone by.   ","['this', 'freedom', 'in', 'gone']",4,"['freedom', 'gone']",['gone'],2,1
4,15,  ‘What is action? What is inaction?'—here even the wise are perplexed. I will  then expound to you that action knowing which you shall be saved from evil.   ,"['expo', 'to', 'that', 'from']",4,['expo'],[],1,0
4,16,"  For it is meet to know the meaning of action, of forbidden action, as also  inaction. Impenetrable is the secret of action.   ",['Impenetrable'],1,['Impenetrable'],[],1,0
4,17,"  Who sees action in action and action in inaction, he is enlightened among  men, he is a yogi, he has done all he need do.    ","['se', 'in', 'in']",3,['se'],[],1,0
4,18,"  He whose every undertaking is free from desire and selfish purpose, and he  who has burnt all his actions in the fire of knowledge—such an one the wise call  a pandita.   ","['free from', 'burnt', 'in', 'fire']",4,"['free from', 'burnt', 'fire']",[],3,0
4,19,"  He who has renounced attachment to the fruit of action, who is ever content,  and free from all dependence,—he, though immersed in action, yet acts not.   ","['ren', 'attachment to', 'fruit', 'free from', 'immer', 'in']",6,"['ren', 'attachment to', 'fruit', 'free from', 'immer']",[],5,0
4,20,"  Expecting nothing, holding his mind and body in check, putting away every  possession, and going through action only in the body he incurs no stain.   ","['in', 'through', 'incur', 'sta']",4,"['incur', 'sta']",[],2,0
4,21,"  Content with whatever chance may bring, rid of the pairs of opposites, free  from ill-will, even-minded in success and failure, he is not bound though he  acts.   ","['Content with', 'bring', 'rid', 'opposite', 'free from', 'in', 'bound']",7,"['Content with', 'bring', 'rid', 'opposite', 'free from', 'bound']",[],6,0
4,22,"  Of the free soul who has shred all attachment, whose mind is firmly  grounded in knowledge, who acts only for sacrifice, all karma is extinguished.   ","['free', 'shred', 'firm', 'grounded in', 'extingu']",5,"['free', 'shred', 'firm', 'grounded in', 'extingu']","['shred', 'grounded in']",5,2
4,23,  The offering of sacrifice is Brahman; the oblation is Brahman; it is offered by  Brahman in the fire that is Brahman; thus he whose mind is fixed on acts  dedicated to Brahman must needs pass on to Brahman.   ,"['offered', 'in', 'fire', 'fixed on', 'dedicated to', 'pass on to']",6,"['offered', 'fire', 'fixed on', 'dedicated to', 'pass on to']","['offered', 'fixed on', 'dedicated to']",5,3
4,24,"  Some yogins perform sacrifice in the form of worship of the gods, others  offer sacrifice of sacrifice itself in the fire that is Brahman.   ","['in', 'form', 'worship', 'in', 'fire']",5,"['form', 'worship', 'fire']",[],3,0
4,25,  Some offer as sacrifice the sense of hearing and the other senses in the fires  of restraint; others sacrifice sound and the other objects of sense in the fires of  the senses.   ,"['sacrifice', 'in', 'fire', 'restra', 'sacrifice', 'object', 'in', 'fire']",8,"['sacrifice', 'fire', 'restra', 'sacrifice', 'object', 'fire']",[],6,0
4,26,  Others again sacrifice all the activities of the senses and of the vital energy in  the yogic fire of self-control kindled by knowledge.   ,"['sacrifice', 'in', 'fire', 'kindled']",4,"['sacrifice', 'fire', 'kindled']",['kindled'],3,1
4,27,  Some sacrifice with material gifts; with austerities; with yoga; some with the  acquiring and some with the imparting of knowledge. All these are sacrifices of  stern vows and serious endeavour.   ,"['with', 'with', 'with', 'with', 'with', 'these', 'sacrifices', 'stern', 'serious']",9,"['sacrifices', 'stern', 'serious']",[],3,0
4,28,"  Others absorbed in the practices of the control of the vital energy sacrifice  the outward in the inward and the inward in the outward, or check the flow of  both the inward and the outward vital airs.   ","['absorb', 'in', 'practices', 'control', 'sacrifice', 'in', 'in', 'flow', 'vital']",9,"['absorb', 'practices', 'control', 'sacrifice', 'flow', 'vital']",[],6,0
4,29,"  Yet others, abstemious in food, sacrifice one form of vital energy in another.  All these know what sacrifice is and purge themselves of all impurities by  sacrifice.   ","['in', 'sacrifice', 'form', 'vital', 'in', 'these', 'purge']",7,"['sacrifice', 'form', 'vital', 'purge']",[],4,0
4,30,"  Those who partake of the residue of sacrifice—called amrita  (ambrosia)—attain to everlasting Brahman. Even this world is not for a  non-sacrificer; how then the next, O Arjuna?   ","['Those', 'partake', 'residue', 'attain to', 'this', 'then', 'next']",7,"['partake', 'residue', 'attain to', 'then', 'next']",[],5,0
4,31,  Even so various sacrifices have been described in the Vedas; know them all  to proceed from action; knowing this you shall be released.   ,"['in', 'proceed from', 'this']",3,['proceed from'],[],1,0
4,32,"  Knowledge-sacrifice is better, O-Parantapa, than material sacrifice, for all  action which does not bind finds its consummation in Knowledge (jnana).   ","['sa', 'sacrifice', 'bind find', 'consummation in']",4,"['sa', 'sacrifice', 'bind find', 'consummation in']",[],4,0
4,33,  The masters of knowledge who have seen the Truth will impart to you this  Knowledge; learn it through humble homage and service and by repeated  questioning.   ,"['master', 'seen', 'to', 'this', 'through humb', 'by']",6,"['master', 'seen', 'through humb']",['seen'],3,1
4,34,"  When you have gained this knowledge, O Arjuna, you shall not again fall  into such error; by virtue of it you shall see all beings without exception in  yourself and thus in Me.   ","['gain', 'this', 'fall into', 'see', 'without', 'in', 'in']",7,"['gain', 'fall into', 'see']",['see'],3,1
4,35,"  Even though you be the most sinful of sinners, you shall cross the ocean of  sin by the boat of knowledge.   ","['cross', 'ocean', 'boat']",3,"['cross', 'ocean', 'boat']",[],3,0
4,36,"  As a blazing fire turns its fuel to ashes, O Arjuna, even so the fire of  Knowledge turns all actions to ashes.   ","['turn', 'to', 'fire', 'turn', 'to']",5,"['turn', 'fire', 'turn']",[],3,0
4,37,  There is nothing in this world so purifying as Knowledge. He who is  perfected by yoga finds it in himself in the fullness of time.   ,"['in this', 'pur', 'find', 'in', 'in', 'fullness']",6,"['in this', 'pur', 'find', 'fullness']",['find'],4,1
4,38,"  It is the man of faith who gains knowledge—the man who is intent on it and  who has mastery over his senses; having gained knowledge, he comes before long  to the supreme peace.   ","['gain', 'on', 'has', 'over', 'gain', 'comes before', 'to']",7,"['gain', 'has', 'gain', 'comes before']","['has', 'comes before']",4,2
4,39,"  But the man of doubt, without knowledge and without faith, is lost; for him  who is given to doubt there is neither this world nor that beyond, nor  happiness.   ","['without', 'without', 'lost', 'given to', 'this', 'that beyond']",6,"['lost', 'given to', 'that beyond']","['lost', 'given to']",3,2
4,40,"  He who has renounced all action by means of yoga, who has severed all  doubt by means of knowledge—him self-possessed, no actions bind, O  Arjuna!   ","['severed', 'bind']",2,"['severed', 'bind']",['severed'],2,1
4,41,"  Therefore, with the sword of Self-realization sever you this doubt, bred of  ignorance, which has crept into your heart! Betake yourself to yoga and arise, O  Arjuna! ","['with', 'sword', 'sever', 'this', 'bred', 'crept into', 'heart', 'Betake', 'to', 'arise']",10,"['sword', 'sever', 'bred', 'crept into', 'heart', 'Betake', 'arise']","['bred', 'Betake']",7,2
9,1,"  I will now declare to you, who are uncensorious, this mysterious knowledge,  together with discriminative knowledge, knowing which you shall be released  from ill.   ","['to', 'this my', 'from']",3,['this my'],[],1,0
9,2,"  This is the king of sciences, the king of mysteries, pure and sovereign, capable  of direct comprehension, the essence of dharma, easy to practice, changeless.   ","['This', 'king', 'king', 'pure', 'direct', 'essence', 'dharma', 'change']",8,"['king', 'king', 'pure', 'direct', 'essence', 'dharma', 'change']",[],7,0
9,3,"  Men who have no faith in this doctrine, O Arjuna, far from coming to Me,  return repeatedly to the path of this world of death.   ","['have', 'in this', 'far', 'return', 'to', 'path', 'this world']",7,"['have', 'in this', 'far', 'return', 'path', 'this world']",['have'],6,1
9,4,"  By Me, unmanifest in form, this whole world is pervaded; all beings are in  Me, I am not in them.   ","['in form', 'this whole', 'in', 'in']",4,"['in form', 'this whole']",[],2,0
9,5,"  And yet those beings are not in Me. That indeed is My unique power as Lord!  Sustainer of all beings, I am not in them; My Self brings them into existence.   ","['those', 'in', 'That', 'power', 'Lord', 'in', 'brings', 'into']",8,"['power', 'Lord', 'brings']",[],3,0
9,6,"  As the mighty wind, moving everywhere, is ever contained in ether, even so  know that all beings are contained in Me.   ","['might', 'contain', 'in', 'contain', 'in']",5,"['might', 'contain', 'contain']",['might'],3,1
9,7,"  All beings, O Arjuna, merge into my prakriti, at the end of a kalpa, and I  send them forth again when a kalpa begins.   ","['merge into', 'at', 'end']",3,"['merge into', 'end']",[],2,0
9,8,"  Resorting to my prakriti, I send forth again and again this multitude of  beings, powerless under the sway of prakriti.   ","['Resort', 'to', 'this', 'under', 'sway']",5,"['Resort', 'sway']",[],2,0
9,9,"  But all this activity, O Arjuna, does not bind Me, seated as one  indifferent, unattached to it.   ","['this', 'bind', 'unattache', 'to']",4,"['bind', 'unattache']",[],2,0
9,10,"  With me as Presiding Witness, prakriti gives birth to all that moves and does  not move; and because of this, O Arjuna, the wheel of the world keeps going.   ","['With', 'gives birth to', 'this', 'wheel', 'going']",5,"['gives birth to', 'wheel', 'going']","['gives birth to', 'going']",3,2
9,11,"  Not knowing My transcendent nature as the sovereign Lord of all beings,  fools condemn Me incarnated as man.   ","['nature', 'Lord']",2,"['nature', 'Lord']",[],2,0
9,12,"  Vain are the hopes, actions and knowledge of those witless ones who have  resorted to the delusive nature of monsters and devils.   ","['those', 'resort', 'to', 'sive nature']",4,"['resort', 'sive nature']",[],2,0
9,13,"  But those great souls who resort to the divine nature, O Arjuna, know Me as  the Imperishable Source of all beings and worship Me with an undivided mind.   ","['those great', 'resort to', 'nature', 'Source', 'with']",5,"['those great', 'resort to', 'nature', 'Source']",[],4,0
9,14,"  Always declaring My glory, striving in steadfast faith, they do Me devout  homage; ever attached to Me, they worship Me.   ","['in ste', 'fast', 'devout', 'attached to']",4,"['in ste', 'fast', 'devout', 'attached to']",['attached to'],4,1
9,15,"  Yet others, with knowledge-sacrifice, worship Me, who am to be seen  everywhere, as one, as different or as many.   ","['with', 'sa', 'fice']",3,"['sa', 'fice']",[],2,0
9,16,  I am the sacrificial vow; I am the sacrifice; I the ancestral oblation; I the herb;  I the sacred text; I the clarified butter; I the fire; I the burnt offering.   ,[],0,[],[],0,0
9,17,"  Of this universe I am the Father, Mother, Creator, Grandsire: I am what is to  be known, the sacred syllable AUM; the Rig, the Saman and the Yajus;     ","['this', 'sacred']",2,['sacred'],['sacred'],1,1
9,18,"  I am the Goal, the Sustainer, the Lord, the Witness, the Abode, the Refuge,  the Friend; the Origin, the End the Preservation, the Treasure house, the  Imperishable Seed.   ","['End', 'house', 'able Seed']",3,"['End', 'house', 'able Seed']",[],3,0
9,19,"  I give heat; I hold back and pour forth rain; I am deathlessness and also  death. O Arjuna, Being and not-Being as well.   ","['give', 'pour']",2,"['give', 'pour']",['give'],2,1
9,20,"  Followers of the three Vedas, who drink the soma juice and are purged of  sin, worship Me with sacrifice and pray for going to heaven; they reach the holy  world of the gods and enjoy in heaven the divine joys of the gods.   ","['pur', 'with', 'reach', 'world', 's']",5,"['pur', 'reach', 'world', 's']",[],4,0
9,21,"  They enjoy the vast world of heaven, and their merit spent, they enter the  world of the mortals; thus those who, following the Vedic law, long for the fruit  of their action earn but the round of birth and death.   ","['world', 'spent', 'enter', 'world', 'following', 'long', 'fruit', 'round']",8,"['world', 'spent', 'enter', 'world', 'following', 'long', 'fruit', 'round']",['following'],8,1
9,22,"  As for those who worship Me, thinking on Me alone and nothing else, ever  attached to Me, I bear the burden of getting them what they need.   ","['those', 'on', 'attached to', 'bear', 'n']",5,"['attached to', 'bear', 'n']",['attached to'],3,1
9,23,"  Even those who, devoted to other gods, worship them in full faith, even  they, O Arjuna, worship none but Me, though not according to the rule.   ","['devo', 'to', 'in full', 'rule']",4,"['devo', 'in full', 'rule']",[],3,0
9,24,"  For I am the Acceptor and the Director of all sacrifices; but not recognizing  Me as I am, they go astray.   ",['go astra'],1,['go astra'],['go astra'],1,1
9,25,  Those who worship the gods go to the gods; those who worship the manes  go to the manes; those who worship the spirits go to the spirits; but those who  worship Me come to Me.   ,['go to'],1,['go to'],['go to'],1,1
9,26,"  Any offering of leaf, flower, fruit or water, made to Me in devotion, by an  earnest soul, I lovingly accept.   ","['made to', 'in']",2,['made to'],['made to'],1,1
9,27,"  Whatever you do, whatever you eat, whatever you offer as  sacrifice or gift, whatever austerity you do perform, O Arjuna, dedicate all  to Me.   ",['to'],1,[],[],0,0
9,28,"  So doing you shall be released from the bondage of action, yielding good  and evil fruit; having accomplished both renunciation and performance, you  shall be released (from birth and death) and come unto Me.   ","['released from', 'bondage', 'yiel', 'evil fruit', 'from']",5,"['released from', 'bondage', 'yiel', 'evil fruit']",['released from'],4,1
9,29,"  I am the same to all beings; with Me there is non disfavoured, none  favoured; but those who worship Me with devotion are in Me and I in them.   ","['to', 'with', 'with', 'in', 'in']",5,[],[],0,0
9,30,"  A sinner, howsoever great, if he turns to Me with undivided devotion, must  indeed be counted a saint; for he has a settled resolve.   ","['great', 'to', 'with', 'has', 'settled']",5,"['great', 'has', 'settled']","['has', 'settled']",3,2
9,31,"  For soon he becomes righteous and wins everlasting peace; know for a  certainty, O Arjuna, that my bhakta never perishes.   ",['win'],1,['win'],[],1,0
9,32,"  For finding refuge in Me, even those who though are born of the womb of  sin, women, vaishyas, and shudras too, reach the supreme goal.   ","['finding refuge', 'womb', 'reach', 'goal']",4,"['finding refuge', 'womb', 'reach', 'goal']",['finding refuge'],4,1
9,33,"  How much more then, the pure brahmanas and seer-kings who are my  devotees? Do you worship Me, therefore, since you have come to this fleeting  and joyless world.   ","['this', 'ting', 'less']",3,"['ting', 'less']",['ting'],2,1
9,34,"  On Me fix your mind, to Me bring your devotion, to Me offer your sacrifice, to  Me make your obeisance; thus having attached yourself to Me and made Me your  end and aim, to Me indeed shall you come.","['On', 'fix', 'to', 'bring', 'to', 'sacrifice', 'to', 'make', 'attached', 'to', 'made', 'end', 'aim', 'to']",14,"['fix', 'bring', 'sacrifice', 'make', 'attached', 'made', 'end', 'aim']","['make', 'attached', 'made']",8,3
5,1,"  You laud renunciation of actions, O Krishna, whilst at the same time you  laud performance of action; tell me for a certainty which is the better.  The Lord Said:   ","['at', 'Lord']",2,['Lord'],[],1,0
5,2,"  Renunciation and performance of action both lead to salvation; but of the  two, karmayoga (performance) is better than sannyasa (renunciation).     ",['lead to'],1,['lead to'],[],1,0
5,3,  Him one should know as ever renouncing who has no dislikes and likes; for  he who is free from the pairs of opposites is easily released from bondage.    ,"['has', 'free from', 'pair', 'opposite', 'released from']",5,"['has', 'free from', 'pair', 'opposite', 'released from']","['has', 'released from']",5,2
5,4,"  It is the ignorant who speak of sankhya and yoga as different, not so those  who have knowledge. He who is rightly established even in one wins to the  fruit of both.   ","['have', 'in', 'to', 'fruit']",4,"['have', 'fruit']",['have'],2,1
5,5,  The goal that the sankhyas attain is also reached by the yogins. He sees truly  who sees both sankhya and yoga as one.   ,"['goal', 'attain', 'reached', 'se', 'sees']",5,"['goal', 'attain', 'reached', 'se', 'sees']",['reached'],5,1
5,6,"  But renunciation, O Arjuna, is hard to attain except by yoga; the ascetic  equipped with yoga attains Brahman before long.   ","['hard', 'attain', 'equip', 'with', 'a', 'before']",6,"['hard', 'attain', 'equip']",[],3,0
5,7,"  The yogi who has cleared himself, has gained mastery over his mind and all  his senses, who has become one with the soul in all creation, although he acts  he remains unaffected.   ","['clear', 'gain', 'over', 'with', 'in', 'unaffe']",6,"['clear', 'gain', 'unaffe']",[],3,0
5,8,"  The yogi who has seen the Truth knows that it is not he that acts whilst  seeing, hearing, touching, smelling, eating, walking, sleeping, or breathing,   ",['seen'],1,['seen'],['seen'],1,1
5,9,"  Talking, letting go, holding fast, opening or closing the eyes—in the  conviction that is the senses that are moving in their respective spheres.   ","['in', 'that', 'sphere']",3,['sphere'],[],1,0
5,10,"  He who dedicates his actions to Brahman and performs them without  attachment is not smeared by sin, as the lotus-leaf by water.   ","['dedicat', 'to', 'without attachment', 'smea', 'leaf']",5,"['dedicat', 'without attachment', 'smea', 'leaf']",[],4,0
5,11,"  Only with the body, mind and intellect and also with the senses, do the  yogins perform action without attachment for the sake of self-purification.   ","['with', 'with', 'without', 'attachment']",4,['attachment'],[],1,0
5,12,"  A man of yoga obtains everlasting peace by abandoning the fruit of action;  the man ignorant of yoga, selfishly attached to fruit, remains bound.   ","['obtain', 'abandon', 'fruit', 'attached to', 'bound']",5,"['obtain', 'abandon', 'fruit', 'attached to', 'bound']","['obtain', 'attached to']",5,2
5,13,"  Renouncing with the mind all actions, the dweller in the body, who is  master of himself, rests happily in his city of nine gates, neither doing nor  getting anything done.   ","['with', 'in', 'getting']",3,['getting'],['getting'],1,1
5,14,  The Lord creates neither agency nor action for the world; neither does he  connect action with its fruit. It is nature that is at work.   ,"['connect', 'with', 'at work']",3,"['connect', 'at work']",[],2,0
5,15,  The Lord does not take upon Himself anyone's vice or virtue; it is ignorance  that veils knowledge and deludes all creatures.   ,"['take upon', 'veils', 'des']",3,"['take upon', 'veils', 'des']",['take upon'],3,1
5,16,"  But to them whose ignorance is destroyed by the knowledge of soul, this  their knowledge, like the sun, reveals the Supreme.   ","['to', 'destroy', 'this', 'sun', 'reveals', 'Supreme']",6,"['destroy', 'sun', 'reveals', 'Supreme']",[],4,0
5,17,"  Those whose intellect is suffused with That, whose self has become one with  That, who abide in That, and whose end and aim is that, wipe out their sins  with knowledge, and go where there is no return.   ","['Those', 'suffused with That', 'with That', 'in That', 'end', 'aim', 'that', 'wipe out', 'with']",9,"['suffused with That', 'with That', 'in That', 'end', 'aim', 'wipe out']",['suffused with That'],6,1
5,18,"  The men of Self-realization look with an equal eye on a brahmana  possessed of learning and humility, a cow, an elephant, a dog and even a  dog-eater.   ","['on', 'possess']",2,['possess'],[],1,0
5,19,"  In this very body they have conquered the round of birth and death, whose  mind is anchored in sameness; for perfect Brahman is same to all, therefore in  Brahman they rest.   ","['this', 'conque', 'round', 'anchored in', 'to', 'in', 'rest']",7,"['conque', 'round', 'anchored in', 'rest']",['anchored in'],4,1
5,20,"  He whose understanding is secure, who is undeluded, who knows Brahman  and who rests in Brahman, will neither be glad to get what is pleasant, nor sad  to get what is unpleasant.   ","['secure', 'rest', 'in', 'get', 'get']",5,"['secure', 'rest', 'get', 'get']","['get', 'get']",4,2
5,21,"  He who has detached himself from contacts without, finds bliss in soul;  having achieved union with Brahman he enjoys eternal bliss.   ","['detach', 'from contact', 'without', 'find', 'in', 'union with']",6,"['detach', 'from contact', 'find', 'union with']",['find'],4,1
5,22,"  For the joys derived from sense-contacts are nothing but mines of misery;  they have beginning and end, O Arjuna; the wise man does not revel therein.   ","['from', 'contact', 'mines', 'have', 'end', 'therein']",6,"['contact', 'mines', 'have', 'end', 'therein']",['have'],5,1
5,23,"  The man who is able even here on earth, before he is released from the body, to  hold out against the floodtide of lust and wrath,—he is a yogi, he is happy.   ",['against'],1,[],[],0,0
5,24,"  He who finds happiness only within, rest only within, light only  within,—that yogi, having become one with nature, attains to oneness with  Brahman.   ","['find', 'light', 'that', 'with', 'att', 'ins to', 'with']",7,"['find', 'light', 'att', 'ins to']",['find'],4,1
5,25,"  They win oneness with Brahman—the seers whose sins are wiped out,  whose doubts are resolved, who have mastered themselves, and who are  engrossed in the welfare of all beings.   ","['win', 'with', 'seers', 'wi', 'out', 'in']",6,"['win', 'seers', 'wi']",[],3,0
5,26,"  Rid of lust and wrath, masters of themselves, the ascetics who have realized  soul find oneness with Brahman everywhere around them.   ","['Rid', 'master', 'find', 'with']",4,"['Rid', 'master', 'find']","['Rid', 'find']",3,2
5,27,"  That ascetic is ever free—who, having shut out the outward  sense-contacts, sits with his gaze fixed between the brows, outward and inward  breathing in the nostrils made equal; his senses, mind, and reason held in check;  rid of longing, fear and wrath; and intent on Freedom.   ","['free', 'contact', 'with', 'made', 'held in', 'rid', 'on']",7,"['free', 'contact', 'made', 'held in', 'rid']","['made', 'held in']",5,2
5,28,"  That ascetic is ever free—who, having shut out the outward  sense-contacts, sits with his gaze fixed between the brows, outward and inward  breathing in the nostrils made equal; his senses, mind, and reason held in check;  rid of longing, fear and wrath; and intent on Freedom.  ","['free', 'contact', 'with', 'made', 'held in', 'rid', 'on']",7,"['free', 'contact', 'made', 'held in', 'rid']","['made', 'held in']",5,2
5,29,"  Knowing Me as the Acceptor of sacrifice and austerity, the great Lord of all  the worlds, the Friend of all creation, the yogi attains to peace.","['great', 'to']",2,['great'],[],1,0
17,1,"  What, then, O Krishna, is the position of those who forsake the rule of Shastra  and yet worship with faith? Do they act from sattva or rajas or tamas?  The Lord Said:   ","['position', 'forsak', 'rule', 'with', 'from', 'Lord']",6,"['position', 'forsak', 'rule', 'Lord']",[],4,0
17,2,"  Threefold is the faith of men, an expression of their nature in each case; it is  sattvika, rajas or tamasa. Hear you of it.   ","['expression', 'nature in']",2,"['expression', 'nature in']",[],2,0
17,3,"  The faith of every man is in accord with his innate character; man is made up  of faith; whatever his object of faith, even so is he.   ","['with', 'made up']",2,['made up'],['made up'],1,1
17,4,"  Sattvika persons worship the gods; rajas ones, the Yakshas and Rakshasas;  and others—men of tamas—worship manes and spirits.   ",[],0,[],[],0,0
